taskID,jobID,employeeRecorID,taskDescription
4137,5203,1954,"Harness the power of AutoLayout NSLayoutConstraints with a simplified, chainable and expressive syntax. Supports iOS"
4138,4238,3354,"Android optimized event bus that simplifies communication between Activities, Fragments, Threads, Services, etc. Less"
4139,3598,3957,a web proxy tool
4140,3685,5280,Super fast HTML 5 2D rendering engine that uses webGL with canvas fallback
4141,3773,5418,Beautiful charts for iOS/tvOS/OSX! The Apple side of the crossplatform MPAndroidChart.
4142,5542,3813,Polyfill to remove click delays on browsers with touch UIs
4143,1588,817,Less. The dynamic stylesheet language.
4144,3425,4178,Bluebird is a full featured promise library with unmatched performance.
4145,3159,5632,Vagrant is a tool for building and distributing development environments.
4146,4646,2017,The better way to deal with JSON data in Swift
4147,65,4634,Clean Code concepts adapted for JavaScript
4148,2924,4189,The Symfony PHP framework
4149,4959,2647,A window.fetch JavaScript polyfill.
4150,1121,4473,A UI Design Language
4151,1806,4093,"Apache Superset (incubating) is a modern, enterprise-ready business intelligence web application"
4152,532,1548,Beautiful static documentation for your API
4153,3136,2016,"Pug robust, elegant, feature rich template engine for Node.js"
4154,5238,257,The Spring Framework
4155,4157,3308,Open Source PHP Framework (originally from EllisLab)
4156,3868,872,A virtual machine designed for executing programs written in Hack and PHP.
4157,74,3452,"An attempt to answer the age old interview question ""What happens when you type google.com into your browser and pres"
4158,4495,3663,A little bit about a linux kernel
4159,3539,2022,"React Starter Kit isomorphic web app boilerplate (Node.js, Express, GraphQL, React.js, Babel, PostCSS, Webpack, Bro"
4160,2280,5600,A framework for building Mobile cross-platform UI
4161,2185,292,Framework for server-rendered React apps
4162,4038,3536,Monospaced font with programming ligatures
4163,3368,3797,typeahead.js is a fast and fully-featured autocomplete library
4164,4484,3374,"A highly scalable, offline-first foundation with the best developer experience and a focus on performance and best"
4165,2953,3793,"Native AngularJS (Angular) directives for Bootstrap. Smaller footprint (20kB gzipped), no 3rd party JS dependencies ("
4166,3424,3552,"Skeleton: A Dead Simple, Responsive Boilerplate for Mobile-Friendly Development"
4167,4075,922,CodeIssuesPull requestsWiki^_^
4168,3946,2644,"JavaScript image gallery for mobile and desktop, modular, framework independent"
4169,341,4266,"Do's and Don'ts for Android development, by Futurice developers"
4170,144,1512,A code-completion engine for Vim
4171,961,647,"Official ZXing (""Zebra Crossing"") project home"
4172,5077,4981,"The C++ Core Guidelines are a set of tried-and-true guidelines, rules, and best practices about coding in C++"
4173,1586,4756,Unfancy JavaScript
4174,3021,3231,Torch implementation of neural style algorithm
4175,1394,1766,Application Architecture for Building User Interfaces
4176,1858,3237,A Vue.js 2.0 UI Toolkit for Web
4177,771,3083,google hosts
4178,5095,5232,"Build mobile apps with simple HTML, CSS, and JavaScript components."
4179,1760,5262,"Your powerful, rich text editor"
4180,4723,5664,Distributed reliable key-value store for the most critical data of a distributed system
4181,289,1634,"Android/iOS video player based on FFmpeg n3.3, with MediaCodec, VideoToolbox support."
4182,4392,1736,"For slim progress bars like on YouTube, Medium, etc"
4183,1156,3543,A docker-powered PaaS that helps you build and manage the lifecycle of applications
4184,2441,2855,Bitcoin Core integration/staging tree
4185,3189,2587,Streaming torrent client for the web
4186,1101,3105,"Tornado is a Python web framework and asynchronous networking library, originally developed at FriendFeed."
4187,5053,2029,A powerful image downloading and caching library for Android
4188,560,2887,Parse-compatible API server module for Node/Express
4189,2360,433,Collaborative List of Open-Source iOS Apps
4190,5223,1988,Spring Boot
4191,1620,3115,Render After Effects animations natively on Android and iOS
4192,1843,138,The Google I/O 2016 Android App
4193,3014,160,Open source API-compatible alternative to the text editor Sublime Text
4194,650,637,Dumb downloader that scrapes the web
4195,4505,2961,MBProgressHUD + Customizations
4196,4453,998,A promise library for JavaScript
4197,4008,1679,A collection of loading indicators animated with CSS
4198,5580,182,This repo is a collection of awesome Mac applications and tools for developers and designers.
4199,3241,3892,the code that powers reddit.com
4200,2109,1949,The de-facto solution to flexible routing with nested views in AngularJS
4201,3864,5198,"Awesome React Native components, news, tools, and learning material!"
4202,1200,3933,Mirror of Apache Spark
4203,1431,4869,API Documentation Browser
4204,3759,3427,A markdown parser and compiler. Built for speed.
4205,717,1221,Generation of diagram and flowchart from text in a similar manner as markdown
4206,312,2797,JavaScript Animation Engine
4207,3907,275,"Flat UI Free - Design Framework (html/css3/less/js). Flat UI is based on Bootstrap, a comfortable, responsive, and fu"
4208,3122,3273,Accelerated JavaScript animation.
4209,4159,4707,"A curated list of awesome frameworks, libraries and software for the Java programming language."
4210,3367,4509,"Algorithms and data structures in Swift, with explanations!"
4211,5600,2853,Parse CSS and add vendor prefixes to rules by Can I Use
4212,2221,4585,Sentry is a cross-platform crash reporting and aggregation platform.
4213,1682,3740,Seed project for angular apps.
4214,5176,2379,a package manager for javascript
4215,4876,2496,An Android library for managing images and the memory they use.
4216,1480,2920,A customizable life embetterment robot.
4217,2745,1428,sample code for several design patterns in PHP
4218,3935,2504,RxJava bindings for Android
4219,4941,3944,"Principles of Writing Consistent, Idiomatic JavaScript"
4220,5460,4190,"Fast, cross-platform HTTP/2 web server with automatic HTTPS"
4221,3637,1553,Most modern mobile touch slider with hardware accelerated transitions
4222,1417,1039,"Zepto.js is a minimalist JavaScript library for modern browsers, with a jQuery-compatible API"
4223,1884,931,"simple, flexible, fun javascript test framework for node.js & the browser"
4224,3129,3254,MongoDB object modeling designed to work in an asynchronous environment.
4225,333,5510,Modern HTTP benchmarking tool
4226,1047,4551,"A code-searching tool similar to ack, but faster."
4227,525,744,Easy scroll animations for web and mobile browsers.
4228,2416,3688,Simple JavaScript testing framework for browsers and node.js
4229,2554,1884,"Fast, flexible, and lean implementation of core jQuery designed specifically for the server."
4230,892,4656,A community-driven Ruby coding style guide
4231,763,4296,Dropzone is an easy to use drag'n'drop library. It supports image previews and shows nice progress bars.
4232,594,1733,"aka ""Bayesian Methods for Hackers"": An introduction to Bayesian methods + probabilistic programming with a computatio"
4233,5139,2552,A high-level browser automation library.
4234,3692,3167,"Have your own Slack like online chat, built with Meteor."
4235,4151,2329,Emscripten: An LLVM-to-JavaScript Compiler
4236,5114,2567,The Ruby Programming Language
4237,3171,2776,HTTP API design guide extracted from work on the Heroku Platform API
4238,5004,4982,Adds static typing to JavaScript to improve developer productivity and code quality.
4239,4511,4342,A collaborative list of awesome swift resources. Feel free to contribute!
4240,5611,3828,"JavaScript Style Guide, with linter & automatic code fixer"
4241,363,1872,A guide on how to be a Programmer - originally published by Robert L Read
4242,134,4151,The PHP Interpreter
4243,1628,1587,Deep Learning papers reading roadmap for anyone who are eager to learn this amazing tech!
4244,1453,2835,starwatchfork
4245,3112,2046,Official Sass port of Bootstrap 2 and 3.
4246,232,2518,Automatically add a progress bar to your site. #hubspot-open-source
4247,1304,1170,"Updated May 31, 2017"
4248,4352,3183,"A community-driven Emacs distribution - The best editor is neither Emacs nor Vim, it's Emacs *and* Vim!"
4249,2789,3959,Simple and elegant component-based UI library
4250,5338,4116,In-browser code editor
4251,5155,900,"This repo contains the .NET Core foundational libraries, called CoreFX. It includes classes for collections, file sys"
4252,2922,4077,TensorFlow Tutorial and Examples for beginners
4253,976,2470,Swifthttp://dev.swiftguide.cn
4254,3321,4921,Cascading grid layout library
4255,5357,1666,Pure Javascript OCR for 62 Languages
4256,4551,923,Desktop/Android/HTML5/iOS Java game development framework
4257,3930,4319,"Server-side Swift. The Perfect core toolset and framework for Swift Developers. (For mobile back-end development, web"
4258,1382,2223,The MongoDB Database
4259,5229,4679,motion graphics toolbelt for the web
4260,1361,3053,A collection of design patterns/idioms in Python
4261,4911,1399,"Python best practices guidebook, written for Humans."
4262,5091,1998,Prettier is an opinionated code formatter.
4263,2873,3058,A curated list of engineering blogs
4264,5180,704,Smooth asynchronous user interfaces for iOS apps.
4265,4863,2355,"Official repository for IPython itself. Other repos in the IPython organization contain things like the website, docu"
4266,5,1183,A Cocoa / Objective-C wrapper around SQLite
4267,3468,4472,Mostly adequate guide to FP (in javascript)
4268,3815,2650,Parallax Engine that reacts to the orientation of a smart device
4269,1366,501,Daemon for easy but powerful stats aggregation
4270,3558,2056,Interactive development & testing environment for React and React-Native UI components
4271,2477,2881,"Microsoft Cognitive Toolkit (CNTK), an open source deep-learning toolkit"
4272,1599,5563,"Examples of how to do query, style, dom, ajax, event etc like jQuery with plain javascript."
4273,689,2271,Grunt: The JavaScript Task Runner
4274,732,2834,Node.js debugger based on Blink Developer Tools
4275,3579,3012,A practical guide to securing macOS.
4276,3160,4622,Useful resources for creating apps with Electron
4277,662,902,Free Bootstrap 3 Admin Template
4278,866,3946,"beego is an open-source, high-performance web framework for the Go programming language."
4279,937,4645,TextMate is a graphical text editor for OS X 10.9+
4280,2436,4703,"precision color scheme for multiple applications (terminal, vim, etc.) with both dark/light modes"
4281,2032,4033,"A privacy-aware, distributed, open source social network."
4282,2801,1206,Must-watch videos about javascript
4283,2533,616,Tesseract Open Source OCR Engine (main repository)
4284,1397,5199,The repository for high quality TypeScript type definitions.
4285,5212,4704,A CLI workflow for the administration of Mac applications distributed as binaries
4286,1385,3891,The premium icon font for Ionic
4287,2042,5290,Monitor for any changes in your node.js application and automatically restart the server - perfect for development
4288,5244,4908,Faker is a PHP library that generates fake data for you
4289,2056,2106,browser-side require() the node.js way
4290,2915,5373,Make any web page a desktop application
4291,4141,2202,Android developers should collect the following utils(updating)
4292,3816,215,A Performant Transitions and Animations Library
4293,1905,2731,Monospaced font family for user interface and coding environments
4294,4655,4537,"A fast & lightweight polyfill for min/max-width CSS3 Media Queries (for IE 6-8, and more)"
4295,4965,2414,The most cited deep learning papers
4296,5359,1312,Realm is a mobile database: a replacement for Core Data & SQLite
4297,1861,143,"Scalable datastore for metrics, events, and real-time analytics"
4298,5492,3055,A library to simplify iOS animations in Swift.
4299,2459,2750,hub helps you win at git.
4300,155,1216,The exceptionally handsome dashboard framework in Ruby and Coffeescript.
4301,3674,4971,Minimal templating with {{mustaches}} in JavaScript
4302,2959,1349,"Simple, unobtrusive authentication for Node.js."
4303,2003,3950,"A bunch of links to blog posts, articles, videos, etc for learning AngularJS"
4304,4533,5045,Delightful JavaScript Testing.
4305,3058,1203,/
4306,2994,2129,Ajax with less suck - (and node.js HTTP client to match)
4307,3227,1728,Tomorrow Theme the precursor to Base16 Theme
4308,321,938,A file and module loader for JavaScript
4309,5034,5167,"If you want to keep a secret, you must also hide it from yourself."
4310,966,1141,Lovely console emulator package for Windows
4311,2907,1579,Medium.com WYSIWYG editor clone. Uses contenteditable API to implement a rich text solution.
4312,4250,671,The Microservice API Gateway
4313,2201,1862,Open source Slack-alternative in Golang and React - Mattermost
4314,1327,1093,Model framework for Cocoa and Cocoa Touch
4315,4750,2990,An elegant messages UI library for iOS
4316,2548,1781,"CockroachDB - the open source, cloud-native SQL database."
4317,4896,539,The ultimate vim distribution
4318,745,4776,CLI tool for Angular
4319,80,3514,generate massive amounts of fake data in Node.js and the browser
4320,466,1338,An easy way to use pull-to-refresh.
4321,1941,5324,Futuristic JavaScript test runner
4322,1583,3806,An Android library that allows you to easily create applications with slide-in menus. You may use it in your Android
4323,2921,907,Fast 3kb React alternative with the same ES6 API. Components & Virtual DOM.
4324,2694,1571,Most commonly used git tips and tricks.
4325,3784,4395,"NativeScript is an open source framework for building truly native mobile apps with JavaScript. Use web skills, like"
4326,2283,4345,Introspected tunnels to localhost
4327,640,2914,Huge update! Interactive Python coding interview challenges (algorithms and data structures). Includes Anki flashcards.
4328,353,214,This is about useful JS tips!
4329,2796,4476,Sortable is a JavaScript library for reorderable drag-and-drop lists on modern browsers and touch devices. No jQuer
4330,1204,904,"Cocos2d-x is a suite of open-source, cross-platform, game-development tools used by millions of developers all over t"
4331,2473,3436,Gin is a HTTP web framework written in Go (Golang). It features a Martini-like API with much better performance -- up
4332,5397,3009,"An extremely fast, React-like JavaScript library for building modern user interfaces"
4333,577,3937,"Implementation of ImageView for Android that supports zooming, by various touch gestures."
4334,4003,2149,"Yii 2: The Fast, Secure and Professional PHP Framework"
4335,1320,4174,Super Awesome Easy Fetching for Core Data 1!!!11!!!!1!
4336,3364,1151,Netty project - an event-driven asynchronous network application framework
4337,3745,5586,how to write node programs with streams
4338,4396,3924,Frontend Knowledge Structure
4339,4148,826,"Elixir is a dynamic, functional language designed for building scalable and maintainable applications"
4340,2767,4302,Docker Cheat Sheet
4341,2930,4058,jQuery Mobile Framework
4342,2317,3910,A server-side Swift web framework.
4343,3984,1162,"Hystrix is a latency and fault tolerance library designed to isolate points of access to remote systems, services and"
4344,1748,5325,A Swift Autolayout DSL for iOS & OS X
4345,2911,2953,"Drone is a Continuous Delivery platform built on Docker, written in Go"
4346,4261,1568,The official jQuery user interface library.
4347,1147,1028,Full featured HTML framework for building iOS & Android apps
4348,2947,216,Sass makes CSS fun again.
4349,1686,5069,Blazing fast React.js static site generator
4350,4574,2912,The JavaScript library for modern SVG graphics.
4351,675,1295,"A showcase of problems once hard or impossible to solve with CSS alone, now made trivially easy with Flexbox."
4352,4555,3457,This repo is for demonstration purposes only.
4353,4330,3878,Package manager for Xcode
4354,1258,1697,"Flexible and powerful data analysis / manipulation library for Python, providing labeled data structures similar to R"
4355,5072,4117,JavaScript Regular expressions made easy
4356,5320,1347,"Source code of the official F8 app of 2016, powered by React Native and other Facebook open source projects."
4357,1097,4888,Perceptual JPEG encoder
4358,1078,5231,JSPatch bridge Objective-C and Javascript using the Objective-C runtime. You can call any Objective-C class and metho
4359,458,4140,The open-source Trello-like kanban (built with Meteor)
4360,2808,2598,"A starter boilerplate for a universal webapp using express, react, redux, webpack, and react-transform"
4361,1704,4769,Define and run multi-container applications with Docker
4362,4184,3539,"Streisand sets up a new server running L2TP/IPsec, OpenConnect, OpenSSH, OpenVPN, Shadowsocks, sslh, Stunnel, a Tor b"
4363,5432,3197,An Asynchronous HTTP Library for Android
4364,3474,2418,Style guides for Google-originated open-source projects
4365,1075,342,Automated installation of the Microsoft IE App Compat virtual machines
4366,1922,3972,Selectize is the hybrid of a textbox and <select> box. It's jQuery based and it has autocomplete and native-feeling k
4367,1028,5393,"Amaze UI, a mobile-first and modular front-end framework."
4368,230,4389,A clean and lightweight progress HUD for your iOS and tvOS app.
4369,4844,4215,A lightweight and modular front-end framework for developing fast and powerful web interfaces
4370,1483,4553,A collection of useful .htaccess snippets.
4371,2909,2517,"History.js gracefully supports the HTML5 History/State APIs (pushState, replaceState, onPopState) in all browsers. In"
4372,4299,2365,A datepicker for twitter bootstrap (@twbs)
4373,1828,2283,A simple CLI tool for ensuring that a given script runs continuously (i.e. forever)
4374,2256,330,Productive. Reliable. Fast.
4375,2893,2629,JavaScript Testing utilities for React
4376,2620,2038,Everything you need to know to get the job.
4377,3170,2584,Library for fast text representation and classification.
4378,1338,2778,Content aware image cropping
4379,5227,236,A creative-commons book on Backbone.js for beginners and advanced users alike
4380,4473,2564,Cross-browser storage for all use cases Used across the web See below for v2.0 news!
4381,4410,416,In-browser markdown editor
4382,2850,5089,Build terminal dashboards using ascii/ansi art and javascript
4383,4106,1699,Reactive Programming in Swift
4384,5384,3732,Next-generation ES6 module bundler
4385,1377,1723,LevelDB is a fast key-value storage library written at Google that provides an ordered mapping from string keys to st
4386,537,5404,The aurelia framework brings together all the required core aurelia libraries into a ready-to-go application-building
4387,3899,4597,"A curated list of awesome command-line frameworks, toolkits, guides and gizmos. Inspired by awesome-php."
4388,5444,619,"Simple, scalable state management."
4389,1607,5448,"ES2015 [ES6] cheatsheet containing tips, tricks, best practices and code snippets"
4390,3393,518,The Light Table IDE
4391,3417,2668,"A simple, decentralized dependency manager for Cocoa"
4392,4496,3160,"Prepack is a partial evaluator for JavaScript. Prepack rewrites a JavaScript bundle, resulting in JavaScript code tha"
4393,2171,3154,Remote multi-server automation tool
4394,4775,4246,Smooth scrolling for the web
4395,5484,3625,List of Computer Science courses with video lectures.
4396,1027,400,A realtime distributed messaging platform
4397,5556,4500,Simple responsive charts
4398,2284,5687,A collection of tips to help take your CSS skills pro
4399,2504,3917,The Servo Browser Engine
4400,5267,5427,Octopress is an obsessively designed framework for Jekyll blogging. Its easy to configure and easy to deploy. Sweet
4401,1992,4723,A GNU Social-compatible microblogging server
4402,184,950,Simplified and community-driven man pages
4403,1529,2394,A pure node.js JavaScript Client implementing the MySql protocol.
4404,5319,1438,"Updated Apr 18, 2017"
4405,3218,104,Groom your apps Ruby environment
4406,1882,2672,Dependency Manager for PHP
4407,3644,2594,CodeHub is an iOS application written using Xamarin
4408,3991,418,"A simple HTML5, YouTube and Vimeo player"
4409,1268,3939,Responsive dashboard templates for Bootstrap
4410,2634,3178,"Curated tutorial and resource links I've collected on React, Redux, ES6, and more"
4411,2713,4610,A curated list of awesome iOS UI/UX libraries
4412,5591,3035,Service Discovery and Configuration Made Easy
4413,2766,1160,The Cocoa Dependency Manager.
4414,1298,494,The ultimate Vim configuration: vimrc
4415,561,2218,A fast JSON parser/generator for Java
4416,3446,1204,Play Framework
4417,5527,1249,"A simple, highly customisable, data-driven 3D carousel for iOS and Mac OS"
4418,2183,350,Android Transition animations explanation with examples.
4419,441,3993,Light and responsive lightbox script with focus on performance.
4420,1505,5192,Classy web framework for Go
4421,3653,1779,Fast Android Development. Easy maintainance.
4422,1689,711,Flat Color Framework for iOS (Obj-C & Swift)
4423,4105,4544,"Offline storage, improved. Wraps IndexedDB, WebSQL, or localStorage using a simple but powerful API."
4424,2238,239,"Recently updated with 50 new notebooks! Data science Python notebooks: Deep learning (TensorFlow, Theano, Caffe, Kera"
4425,2034,4223,The official Vim repository
4426,774,4762,Material Design components for Angular
4427,1465,1219,Classy web-development dressed in a DSL (official / canonical repo)
4428,3010,546,HTML5 FLV Player
4429,709,4385,lean & mean status/tabline for vim that's light as air
4430,2772,2027,Node.js by alsotang
4431,4190,4195,"Material Theme, the most epic theme for Sublime Text 3 by Mattia Astorino"
4432,3153,2512,Algorithm Visualizer
4433,2294,2146,"Guzzle, an extensible PHP HTTP client"
4434,1470,2113,"WordPress, Git-ified. Synced via SVN every 15 minutes, including branches and tags! This repository is just a mirror"
4435,5165,914,A command-line fuzzy finder written in Go
4436,1236,3586,
4437,4726,3654,Elegant transition library for iOS & tvOS
4438,2165,3845,"SQL powered operating system instrumentation, monitoring, and analytics."
4439,2051,565,Code tree for GitHub
4440,567,4526,"Auditing, performance metrics, and best practices for Progressive Web Apps"
4441,1256,2179,Codeless drop-in universal library allows to prevent issues of keyboard sliding up and cover UITextField/UITextView.
4442,1455,1721,"A collection of awesome browser-side JavaScript libraries, resources and shiny things."
4443,1351,473,A spring that solves your animation problems.
4444,286,3416,A CLI dashboard for webpack dev server
4445,4235,2554,Give your pages some headroom. Hide your header until you need it
4446,3246,4229,LoopBack makes it easy to build modern applications that require complex integrations.
4447,3856,954,REST API for any Postgres database
4448,408,2440,A typeface designed for source code
4449,2686,1855,pathogen.vim: manage your runtimepath
4450,1541,2252,Standards either proposed or approved by the Framework Interop Group
4451,328,1644,"A fast & simple, yet powerful & flexible logging framework for Mac and iOS"
4452,3061,4107,"A responsive image polyfill for <picture>, srcset, sizes, and more"
4453,1353,4255,"Tinker is a hot-fix solution library for Android, it supports dex, library and resources update without reinstall apk."
4454,5189,2400,A curated list of awesome remote jobs and resources. Inspired by https://github.com/vinta/awesome-python
4455,3843,1987,"Get started with React, Redux, and React-Router."
4456,1326,3196,A Java serialization/deserialization library to convert Java Objects into JSON and back
4457,5217,1979,JavaScript Vector Library
4458,706,961,"Dubbo is a distributed, high performance RPC framework empowering applications with service import/export capabili"
4459,1697,3810,React Native for macOS is an experimental fork for writing desktop apps using Cocoa
4460,3051,4074,An Android app which provides design news & inspiration as well as being an example of implementing material design.
4461,227,5617,Command-line JSON processor
4462,2666,2817,Jargon from the functional programming world in simple terms!
4463,3423,2685,"Code and data for paper ""Deep Photo Style Transfer"": https://arxiv.org/abs/1703.07511"
4464,3837,1485,uBlock Origin - An efficient blocker for Chromium and Firefox. Fast and lean.
4465,3204,5068,& Apps///
4466,5154,1016,Font files available from Google Fonts
4467,501,3706,Resume template for Chinese programmers . PHPiOSAndroidWebJavaC
4468,597,2958,Create an Apple-like one page scroller website (iPhone 5S website) with One Page Scroll plugin
4469,3684,2484,Themes for Bootstrap
4470,4378,2722,Relay is a JavaScript framework for building data-driven React applications.
4471,316,3107,- PouchDB is a pocket-sized database.
4472,332,5548,Paging indicator widgets compatible with the ViewPager from the Android Support Library and ActionBarSherlock.
4473,2414,2132,A Powerful Spider(Web Crawler) System in Python.
4474,1152,3361,Your guide to the (sometimes overwhelming!) React ecosystem.
4475,5442,3714,An iOS library to natively render After Effects vector animations
4476,762,217,List of useful Quick Look plugins for developers
4477,1059,1663,Mars is a cross-platform network component developed by WeChat.
4478,3062,694,"Distributed and fault-tolerant realtime computation: stream processing, continuous computation, distributed RPC, and"
4479,4358,4618,The classic email sending library for PHP
4480,1919,184,A self-taught project to learn Swift.
4481,5149,4892,Metasploit Framework
4482,203,1957,"CSS is powerful, you can do a lot of things without JS."
4483,2623,2225,
4484,3820,3448,"Updated Jun 12, 2017"
4485,5477,4465,Universal markup converter
4486,5597,1391,React Nativereact-nativeApp
4487,1198,5206,A public list of APIs from round the web.
