taskID,jobID,employeeRecorID,taskDescription
1,1248,3532,The https://freeCodeCamp.com open source codebase and curriculum. Learn to code and help nonprofits.
2,2896,2877,"The most popular HTML, CSS, and JavaScript framework for developing responsive, mobile first projects on the web."
3,1853,3876,Freely available programming books
4,4768,2790,"A declarative, efficient, and flexible JavaScript library for building user interfaces."
5,4436,4683,"Bring data to life with SVG, Canvas and HTML."
6,4582,3402,A book series on JavaScript. @YDKJS on twitter.
7,758,764,Computation using data flow graphs for scalable machine learning
8,4652,4789,Curated list of awesome lists
9,589,4338,"A progressive, incrementally-adoptable JavaScript framework for building UI on the web."
10,2173,5182,AngularJS - HTML enhanced for web apps!
11,4892,4300,"A delightful community-driven (with 1,000+ contributors) framework for managing your zsh configuration. Includes 200+"
12,4275,984,JavaScript Style Guide
13,3415,5334,A collection of useful .gitignore templates
14,3787,573,The iconic font and CSS toolkit
15,571,702,A framework for building native apps with React.
16,1393,5383,"Build cross platform desktop apps with JavaScript, HTML, and CSS"
17,1923,1393,Linux kernel source tree
18,4675,563,jQuery JavaScript Library
19,3152,1558,A complete computer science study plan to become a software engineer.
20,2823,1184,Moby Project - a collaborative project for the container ecosystem to assemble container-based systems
21,313,2549,A cross-browser library of CSS animations. As easy to use as an easy thing.
22,5422,2763,The Swift Programming Language
23,5296,2940,The hackable text editor
24,2114,4598,"Meteor, the JavaScript App Platform"
25,2117,2738,"A professional front-end template for building fast, robust, and adaptable web apps or sites."
26,1974,3208,Node.js JavaScript runtime
27,2007,2873,Moved to https://github.com/nodejs/node
28,3465,374,Ruby on Rails
29,256,2232,Semantic is a UI component framework based around useful principles from natural language.
30,5197,1816,"A curated list of awesome Python frameworks, libraries, software and resources"
31,4298,5487,The HTML Presentation Framework
32,1467,837,Realtime application framework (Node.JS server)
33,304,5580,JavaScript 3D library.
34,2550,3725,A PHP Framework For Web Artisans
35,504,4609,"Fast, unopinionated, minimalist web framework for node."
36,898,3198,Predictable state container for JavaScript apps
37,1293,1978,"Parse, validate, manipulate, and display dates in javascript."
38,631,2819,It's a presentation framework based on the power of CSS3 transforms and transitions in modern browsers and inspired b
39,375,5358,Call all Node.js modules directly from DOM/WebWorker and enable a new way of writing applications with all Web techno
40,467,2583,"Master the command line, in one page"
41,5435,4406,Simple HTML5 Charts using the <canvas> tag
42,1450,4913,Material Design icons by Google
43,1479,5246,"Modern command line HTTP client user-friendly curl alternative with intuitive UI, JSON support, syntax highlighting"
44,1563,1563,Build amazing native and progressive web apps with open web technologies. One app running on everything
45,2074,5559,"Jekyll is a blog-aware, static site generator in Ruby"
46,3299,3636,Visual Studio Code
47,4661,3116,A bundler for javascript and friends. Packs many modules into a few bundled assets. Code Splitting allows to load par
48,54,2492,Resumes generated using the GitHub informations
49,2530,4149,"A delightful networking framework for iOS, OS X, watchOS, and tvOS."
50,2520,1012,The Go programming language
51,2830,870,Create React apps with no build configuration.
52,2344,4734,The former home of Homebrew
53,5569,3565,Magnificent app which corrects your previous console command.
54,5157,4586,"A list of helpful front-end related questions you can use to interview potential candidates, test yourself or complet"
55,1699,2801,"A microframework based on Werkzeug, Jinja2 and good intentions"
56,4972,3931,Based on a true story
57,4859,5652,Material Design Components in HTML/CSS/JS
58,1041,4877,"An open source code editor for the web, written in JavaScript, HTML and CSS."
59,1339,3483,"Materialize, a CSS Framework based on Material Design"
60,3580,4676,"File Upload widget with multiple file selection, drag&drop support, progress bar, validation and preview images, audi"
61,5236,3907,Command-line program to download videos from YouTube.com and other video sites
62,2209,157,A collection of HTML element and attribute style-normalizations
63,1746,2422,The streaming build system
64,4390,1531,React Components that Implement Google's Material Design.
65,233,760,"Give your JS App some Backbone with Models, Views, Collections, and Events"
66,3096,1804,The Web framework for perfectionists with deadlines.
67,3941,2112,"Fast, reliable, and secure dependency management."
68,58,839,Python HTTP Requests for Humans
69,2039,5328,The most advanced responsive front-end framework in the world. Quickly create prototypes and production code for site
70,2741,261,One framework. Mobile & desktop.
71,1791,2036,RxJava Reactive Extensions for the JVM a library for composing asynchronous and event-based programs using observ
72,106,124,Original Apollo 11 Guidance Computer (AGC) source code for the command and lunar modules.
73,5025,556,Production-Grade Container Scheduling and Management
74,5146,2057,"A modern JavaScript utility library delivering modularity, performance, & extras."
75,2062,4321,Elegant HTTP Networking in Swift
76,3645,3383,"Redis is an in-memory database that persists on disk. The data model is key-value, but many different kind of values"
77,5488,252,A curated list of awesome Android UI/UX libraries
78,5045,3244,Ansible is a radically simple IT automation platform that makes your applications and systems easier to deploy. Avoid
79,2163,2455,Lantern Latest Download https://github.com/getlantern/lantern/releases/tag/latest https://github.com/getl
80,5551,5282,"A curated list of awesome Machine Learning frameworks, libraries and software."
81,4912,706,Roadmap to becoming a web developer in 2017
82,5262,5671,Papers from the computer science community to read and discuss.
83,77,4336,"Open Source, Distributed, RESTful Search Engine"
84,4143,478,A categorized collection of Android Open Source Projects : codekk
85,1098,1780,Vim-fork focused on extensibility and usability.
86,609,2176,TypeScript is a superset of JavaScript that compiles to clean JavaScript output.
87,3823,1415,An extensible desktop mail app built on the modern web. Forks welcome!
88,2222,229,Declarative routing for React
89,1638,1631,"A simple, powerful publishing platform"
90,5510,5556,Angular Style Guide: A starting point for Angular development teams to provide consistency through good practices.
91,4416,915,Get a full fake REST API with zero coding in less than 30 seconds (seriously)
92,1271,3897,Scriptable Headless WebKit
93,3639,2780,Path to a free self-taught education in Computer Science!
94,36,5307,A list of cool features of Git and GitHub.
95,3193,2761,"A safe, concurrent, practical language."
96,2929,3522,"Type-safe HTTP client for Android and Java by Square, Inc."
97,5419,775,"A platform for community discussion. Free, open, simple."
98,4718,5076,Get control of your servers. Simple. Effective. Awesome! https://my-netdata.io/
99,890,3132,Manually curated collection of resources for frontend web developers.
100,64,2695,Promise based HTTP client for the browser and node.js
101,4067,1850,"A curated list of awesome Go frameworks, libraries and software"
102,1237,2506,Async utilities for node and the browser
103,5006,2321,Babel is a compiler for writing next generation JavaScript.
104,5249,4022,"Helping you select an MV* framework - Todo apps for Backbone.js, Ember.js, AngularJS, and many more"
105,3333,5680,The Big List of Naughty Strings is a list of strings which have a high probability of causing issues when used as use
106,4586,2712,"Scrapy, a fast high-level web crawling & scraping framework for Python."
107,529,5108,JavaScript's utility _ belt
108,4197,1557,"Chosen is a library for making long, unwieldy select boxes more friendly."
109,2466,5691,Overview of ECMAScript 6 features
110,3337,4957,Modernizr is a JavaScript library that detects HTML5 and CSS3 features in the users browser.
111,1671,2896,An HTTP+HTTP/2 client for Android and Java applications.
112,3138,4013,"Select2 is a jQuery based replacement for select boxes. It supports searching, remote data sets, and infinite scrolli"
113,3497,484,"A curated list of awesome iOS ecosystem, including Objective-C and Swift Projects"
114,3370,801,"Google Chrome, Firefox, and Thunderbird extension that lets you write email in Markdown and render it before sending."
115,1073,4629,A boilerplate for Node.js web applications
116,1916,458,A collection of awesome things regarding React ecosystem.
117,1960,1719,Node Version Manager - Simple bash script to manage multiple active node.js versions
118,642,1387,Design patterns implemented in Java
119,5483,786,List of awesome university courses for learning Computer Science!
120,1310,5368,Gogs is a painless self-hosted Git service.
121,5374,996,Production process manager for Node.js apps with a built-in load balancer.
122,5215,919,fullPage plugin by Alvaro Trigo. Create full screen pages fast and simple
123,1299,859,GitLab CE | Please open new issues in our issue tracker on GitLab.com
124,1224,4875,A list of practical projects that anyone can solve in any programming language.
125,2367,1929,scikit-learn: machine learning in Python
126,3689,4092,A collection of samples to discuss and showcase different architectural tools and patterns for Android apps.
127,518,769,Immutable persistent data collections for Javascript which increase efficiency and simplicity.
128,1542,4291,The open-source database for the realtime web.
129,2242,3388,"An awesome list of high-quality open datasets in public domains (on-going). By everyone, for everyone!"
130,4035,4398,A list of everything that could go in the <head> of your document
131,1413,751,A curated list of awesome awesomeness
132,2046,2901,"Certbot, previously the Let's Encrypt Client, is EFF's tool to obtain certs from Let's Encrypt, and (optionally) auto"
133,1970,1633,A collective list of public JSON APIs for use in web development.
134,4543,5411,JavaScript library for mobile-friendly interactive maps
135,1860,4364,"A powerful, interactive charting and visualization library for browser"
136,1061,1509,Caffe: a fast open framework for deep learning.
137,5342,587,the last carousel you'll ever need
138,243,5365,
139,2193,2859,Extensive Open-Source Guides for Android Developers
140,5434,4156,PDF Reader in JavaScript
141,1469,269,Material design theme for Bootstrap 3 and 4
142,5558,4988,"Updated Jun 24, 2017"
143,2971,5161,Protocol Buffers - Google's data interchange format
144,797,323,Git Source Code Mirror - This is a publish-only repository and all pull requests are ignored. Please follow Documenta
145,4295,1636,A Fast and Flexible Static Site Generator built with love in GoLang.
146,3814,3109,Ember.js - A JavaScript framework for creating ambitious web applications
147,1680,2109,Asynchronous image downloader with cache support as a UIImageView category
148,1317,1566,Build modern apps using web components
149,3793,5532,Modern copy to clipboard. No Flash. Just 3kb gzipped
150,4580,5319,"An extensible iOS and OS X animation library, useful for physics-based interactions."
151,2027,3948,Delightful Node.js packages and resources
152,3567,3705,Models built with TensorFlow
153,3307,2615,Git extensions to provide high-level repository operations for Vincent Driessen's branching model.
154,3744,358,Learn how to design large-scale systems. Prep for the system design interview. Includes Anki flashcards.
155,4048,4479,A terminal built on web technologies
156,2092,4018,A curated list of awesome things related to Vue.js
157,3142,2398,Streams of values over time
158,1247,5483,"Serverless Framework Build web, mobile and IoT applications with serverless architectures using AWS Lambda, Azure F"
159,4817,2309,Realtime MVC Framework for Node.js
160,4255,2037,Flexible authentication solution for Rails with Warden.
161,2988,5001,Design Patterns for Humans - An ultra-simplified explanation
162,4506,5363,Stand-alone parallax scrolling library for mobile (Android + iOS) and desktop. No jQuery. Just plain JavaScript (and
163,601,4702,Amazon Web Services a practical guide
164,1426,4873,Google Core Libraries for Java
165,478,503,Use your OS X terminal shell to do awesome things.
166,159,5350,AdminLTE - Free Premium Admin control Panel Theme Based On Bootstrap 3.x
167,2628,1544,Apple Swift The Swift Programming Language
168,1403,994,"A set of small, responsive CSS modules that you can use in every web project."
169,1227,1021,".files, including ~/.macos sensible hacker defaults for macOS"
170,4872,1467,"A collection of CSS3 powered hover effects to be applied to links, buttons, logos, SVG, featured images and so on. Ea"
171,2934,5055,"Deep Learning library for Python. Runs on TensorFlow, Theano, or CNTK."
172,5160,2699,"A fast, simple & powerful blog framework, powered by Node.js."
173,550,1407,Bind Android views and callbacks to fields and methods.
174,4700,5305,Video.js - open source HTML5 & Flash video player
175,731,5275,Web Starter Kit - a workflow for multi-device websites
176,4324,3277,Security Guide for Developers ()
177,2570,1790,The easiest way to automate building and releasing your iOS and Android apps
178,2733,1300,A golang ebook intro how to build a web with golang
179,4234,1630,"The tool for beautiful monitoring and metric analytics & dashboards for Graphite, InfluxDB & Prometheus & More"
180,2418,3123,The Reactive Extensions for JavaScript
181,3908,624,Modern CSS framework based on Flexbox
182,2614,4518,Create agents that monitor and act on your behalf. Your agents are standing by!
183,3330,2727,A javascript library for multi-touch gestures :// You can touch this
184,110,3313,Open Source Computer Vision Library
185,633,4034,"A powerful Android chart view / graph view library, supporting line- bar- pie- radar- bubble- and candlestick charts"
186,85,2789,Open Source Continuous File Synchronization
187,844,3765,This is a list of Free Software network services and web applications which can be hosted locally. Selfhosting is the
188,4939,1583,A terminal emulator for the 21st century.
189,870,446,An image loading and caching library for Android focused on smooth scrolling
190,2385,4623,Drag and drop so simple it hurts
191,3881,270,"A beautiful replacement for JavaScript's ""alert"""
192,4486,1443,Expressive middleware for node.js using ES2017 async functions
193,5097,1575,"A list of SaaS, PaaS and IaaS offerings that have free tiers of interest to devops and infradev"
194,1355,3921,Simplified HTTP request client.
195,1251,3418,An open source iOS framework for GPU-based image and video processing
196,3040,4555,Some useful websites for programmers.
197,1230,5151,"A curated list of amazingly awesome PHP libraries, resources and shiny things."
198,1751,3381,500 Lines or Less
199,1605,4532,A memory leak detection library for Android and Java.
200,4609,3812,Material design for AngularJS
201,3491,100,Modern documentation format and toolchain using Git and Markdown
202,653,1334,"Phaser is a fun, free and fast 2D game framework for making HTML5 games for desktop and mobile web browsers, supporti"
203,2388,4055,The Kotlin Programming Language
204,2151,4657,How to Make a Computer Operating System in C++
205,1137,2342,Step-by-step tutorial to build a modern JavaScript stack.
206,5548,317,A better way for new feature introduction and step-by-step users guide for your website and project.
207,4781,4347,"Powerful and flexible library for loading, caching and displaying images on Android."
208,2448,3219,A complete daily plan for studying to become a machine learning engineer.
209,713,807,A curated awesome list of lists of interview questions. Feel free to contribute!
210,5449,5442,Ace (Ajax.org Cloud9 Editor)
211,4974,3330,Transforming styles with JS plugins
212,1125,168,A package manager for the web
213,1309,3290,"Vundle, the plug-in manager for Vim"
214,2890,2219,"A UI library by WeChat official design team, includes the most useful widgets/modules in mobile web applications."
215,2566,2028,pushState + ajax = pjax
216,1334,2580,A curated list of amazingly awesome open source sysadmin resources inspired by Awesome PHP.
217,2054,139,"Harness the power of AutoLayout NSLayoutConstraints with a simplified, chainable and expressive syntax. Supports iOS"
218,2881,4322,"Android optimized event bus that simplifies communication between Activities, Fragments, Threads, Services, etc. Less"
219,2246,4237,a web proxy tool
220,1371,3576,Super fast HTML 5 2D rendering engine that uses webGL with canvas fallback
221,3859,5348,Beautiful charts for iOS/tvOS/OSX! The Apple side of the crossplatform MPAndroidChart.
222,2958,3185,Polyfill to remove click delays on browsers with touch UIs
223,3115,1876,Less. The dynamic stylesheet language.
224,1173,4426,Bluebird is a full featured promise library with unmatched performance.
225,1771,3176,Vagrant is a tool for building and distributing development environments.
226,3660,499,The better way to deal with JSON data in Swift
227,1987,1345,Clean Code concepts adapted for JavaScript
228,3308,2820,The Symfony PHP framework
229,5019,5468,A window.fetch JavaScript polyfill.
230,729,2757,A UI Design Language
231,4054,741,"Apache Superset (incubating) is a modern, enterprise-ready business intelligence web application"
232,3646,5317,Beautiful static documentation for your API
233,2624,3719,"Pug robust, elegant, feature rich template engine for Node.js"
234,3874,3331,The Spring Framework
235,4329,5527,Open Source PHP Framework (originally from EllisLab)
236,411,437,A virtual machine designed for executing programs written in Hack and PHP.
237,1792,2839,"An attempt to answer the age old interview question ""What happens when you type google.com into your browser and pres"
238,3444,2195,A little bit about a linux kernel
239,314,593,"React Starter Kit isomorphic web app boilerplate (Node.js, Express, GraphQL, React.js, Babel, PostCSS, Webpack, Bro"
240,1933,2736,A framework for building Mobile cross-platform UI
241,1313,5221,Framework for server-rendered React apps
242,3360,3994,Monospaced font with programming ligatures
243,3045,366,typeahead.js is a fast and fully-featured autocomplete library
244,4596,5015,"A highly scalable, offline-first foundation with the best developer experience and a focus on performance and best"
245,630,3544,"Native AngularJS (Angular) directives for Bootstrap. Smaller footprint (20kB gzipped), no 3rd party JS dependencies ("
246,4156,4686,"Skeleton: A Dead Simple, Responsive Boilerplate for Mobile-Friendly Development"
247,4542,3851,CodeIssuesPull requestsWiki^_^
248,21,176,"JavaScript image gallery for mobile and desktop, modular, framework independent"
249,3347,2349,"Do's and Don'ts for Android development, by Futurice developers"
250,5163,3935,A code-completion engine for Vim
251,801,2448,"Official ZXing (""Zebra Crossing"") project home"
252,2394,4696,"The C++ Core Guidelines are a set of tried-and-true guidelines, rules, and best practices about coding in C++"
253,3399,2540,Unfancy JavaScript
254,195,5187,Torch implementation of neural style algorithm
255,1631,4046,Application Architecture for Building User Interfaces
256,4,5209,A Vue.js 2.0 UI Toolkit for Web
257,3865,2868,google hosts
258,3167,4935,"Build mobile apps with simple HTML, CSS, and JavaScript components."
259,3938,5621,"Your powerful, rich text editor"
260,3235,2747,Distributed reliable key-value store for the most critical data of a distributed system
261,1524,5419,"Android/iOS video player based on FFmpeg n3.3, with MediaCodec, VideoToolbox support."
262,1690,2538,"For slim progress bars like on YouTube, Medium, etc"
263,4437,973,A docker-powered PaaS that helps you build and manage the lifecycle of applications
264,2432,3025,Bitcoin Core integration/staging tree
265,4384,4386,Streaming torrent client for the web
266,989,3794,"Tornado is a Python web framework and asynchronous networking library, originally developed at FriendFeed."
267,2444,4370,A powerful image downloading and caching library for Android
268,1017,4348,Parse-compatible API server module for Node/Express
269,5581,4851,Collaborative List of Open-Source iOS Apps
270,3986,1155,Spring Boot
271,3326,5253,Render After Effects animations natively on Android and iOS
272,3807,4874,The Google I/O 2016 Android App
273,516,3449,Open source API-compatible alternative to the text editor Sublime Text
274,912,5444,Dumb downloader that scrapes the web
275,1816,2640,MBProgressHUD + Customizations
276,224,2604,A promise library for JavaScript
277,2677,1559,A collection of loading indicators animated with CSS
278,3508,4206,This repo is a collection of awesome Mac applications and tools for developers and designers.
279,1123,1967,the code that powers reddit.com
280,5169,1643,The de-facto solution to flexible routing with nested views in AngularJS
281,2967,5591,"Awesome React Native components, news, tools, and learning material!"
282,3467,5196,Mirror of Apache Spark
283,4627,2346,API Documentation Browser
284,2118,2883,A markdown parser and compiler. Built for speed.
285,1927,2289,Generation of diagram and flowchart from text in a similar manner as markdown
286,1539,3360,JavaScript Animation Engine
287,4302,4768,"Flat UI Free - Design Framework (html/css3/less/js). Flat UI is based on Bootstrap, a comfortable, responsive, and fu"
288,3526,301,Accelerated JavaScript animation.
289,5545,5637,"A curated list of awesome frameworks, libraries and software for the Java programming language."
290,981,4934,"Algorithms and data structures in Swift, with explanations!"
291,644,3135,Parse CSS and add vendor prefixes to rules by Can I Use
292,1346,1042,Sentry is a cross-platform crash reporting and aggregation platform.
293,5499,497,Seed project for angular apps.
294,239,1353,a package manager for javascript
295,1129,3822,An Android library for managing images and the memory they use.
296,2250,2072,A customizable life embetterment robot.
297,2769,5070,sample code for several design patterns in PHP
298,4825,3082,RxJava bindings for Android
299,657,3995,"Principles of Writing Consistent, Idiomatic JavaScript"
300,3017,3555,"Fast, cross-platform HTTP/2 web server with automatic HTTPS"
301,4118,4881,Most modern mobile touch slider with hardware accelerated transitions
302,1454,5332,"Zepto.js is a minimalist JavaScript library for modern browsers, with a jQuery-compatible API"
303,4221,1282,"simple, flexible, fun javascript test framework for node.js & the browser"
304,2763,2158,MongoDB object modeling designed to work in an asynchronous environment.
305,219,5639,Modern HTTP benchmarking tool
306,606,4039,"A code-searching tool similar to ack, but faster."
307,781,2343,Easy scroll animations for web and mobile browsers.
308,409,3905,Simple JavaScript testing framework for browsers and node.js
309,439,2115,"Fast, flexible, and lean implementation of core jQuery designed specifically for the server."
310,2778,5620,A community-driven Ruby coding style guide
311,4272,3826,Dropzone is an easy to use drag'n'drop library. It supports image previews and shows nice progress bars.
312,1378,2638,"aka ""Bayesian Methods for Hackers"": An introduction to Bayesian methods + probabilistic programming with a computatio"
313,497,719,A high-level browser automation library.
314,4274,470,"Have your own Slack like online chat, built with Meteor."
315,760,979,Emscripten: An LLVM-to-JavaScript Compiler
316,678,5087,The Ruby Programming Language
317,200,3751,HTTP API design guide extracted from work on the Heroku Platform API
318,1367,4485,Adds static typing to JavaScript to improve developer productivity and code quality.
319,4149,2559,A collaborative list of awesome swift resources. Feel free to contribute!
320,2514,1546,"JavaScript Style Guide, with linter & automatic code fixer"
321,5293,3989,A guide on how to be a Programmer - originally published by Robert L Read
322,2080,3574,The PHP Interpreter
323,397,4748,Deep Learning papers reading roadmap for anyone who are eager to learn this amazing tech!
324,825,1729,starwatchfork
325,2330,1744,Official Sass port of Bootstrap 2 and 3.
326,5482,3727,Automatically add a progress bar to your site. #hubspot-open-source
327,4857,1291,"Updated May 31, 2017"
328,4954,1418,"A community-driven Emacs distribution - The best editor is neither Emacs nor Vim, it's Emacs *and* Vim!"
329,306,1101,Simple and elegant component-based UI library
330,4132,3547,In-browser code editor
331,4895,2608,"This repo contains the .NET Core foundational libraries, called CoreFX. It includes classes for collections, file sys"
332,1130,939,TensorFlow Tutorial and Examples for beginners
333,2371,747,Swifthttp://dev.swiftguide.cn
334,2476,432,Cascading grid layout library
335,3826,4579,Pure Javascript OCR for 62 Languages
336,1829,1686,Desktop/Android/HTML5/iOS Java game development framework
337,4400,1433,"Server-side Swift. The Perfect core toolset and framework for Swift Developers. (For mobile back-end development, web"
338,4867,2677,The MongoDB Database
339,2806,4600,motion graphics toolbelt for the web
340,2664,1019,A collection of design patterns/idioms in Python
341,2271,5116,"Python best practices guidebook, written for Humans."
342,4077,4563,Prettier is an opinionated code formatter.
343,4073,4181,A curated list of engineering blogs
344,1630,3188,Smooth asynchronous user interfaces for iOS apps.
345,1893,255,"Official repository for IPython itself. Other repos in the IPython organization contain things like the website, docu"
346,1747,2494,A Cocoa / Objective-C wrapper around SQLite
347,2730,3285,Mostly adequate guide to FP (in javascript)
