taskID,jobID,employeeRecorID,taskDescription
2766,3344,1055,"A positioning engine to make overlays, tooltips and dropdowns better #hubspot-open-source"
2767,1606,3470,A circular ImageView for Android
2768,3547,1753,Low-Budget Password Strength Estimation
2769,2868,4848,A JavaScript library dedicated to graph drawing
2770,5606,2181,Nodejs-based tool for optimizing SVG vector graphics files.
2771,5490,3225,Documentation about css-modules
2772,645,4203,A community-curated list of flexbox issues and cross-browser workarounds for them.
2773,1807,523,JSHint is a tool that helps to detect errors and potential problems in your JavaScript code
2774,231,2327,Reveal CSS animation as you scroll down a page
2775,598,3110,Modern Java - A Guide to Java 8
2776,822,5255,"New generation CMS on top of React, Redux and GraphQL"
2777,2601,5185,"Build highly concurrent, distributed, and resilient message-driven applications on the JVM"
2778,803,5471,The official Swift style guide for raywenderlich.com.
2779,868,2623,Cross-platform Linux commands in ES6
2780,3066,5676,Connect is a middleware layer for Node.js
2781,4593,3837,Bloat-free Immediate Mode Graphical User interface for C++ with minimal dependencies
2782,3353,4253,This maintains proposals for changes and user-visible enhancements to the Swift Programming Language.
2783,4367,1516,Firefox for iOS
2784,3518,1650,PowerShell for every system!
2785,5321,586,"Luigi is a Python module that helps you build complex pipelines of batch jobs. It handles dependency resolution, work"
2786,5196,5208,Minio is an open source object storage server compatible with Amazon S3 APIs
2787,4561,2857,ECMAScript 6 JavaScript ECMAScript 6
2788,4615,1479,Open-source home automation platform running on Python 3
2789,153,2884,Bitmap & tilemap generation from a single example with the help of ideas from quantum mechanics.
2790,3278,5538,A Hyperminimal UI Theme for Sublime Text
2791,2742,5698,CakePHP: The Rapid Development Framework for PHP - Official Repository
2792,4308,3323,The easiest way to use git. On any platform. Anywhere.
2793,5112,2951,A HTML5/JavaScript multiplayer game experiment
2794,4515,2063,The Backbone Framework
2795,1691,1052,Cron jobs in Ruby
2796,1737,1245,The fastest way to build beautiful Electron apps using simple HTML and CSS
2797,1356,2808,"rkt is a pod-native container engine for Linux. It is composable, secure, and built on standards."
2798,4676,1064,A standard library for microservices.
2799,4120,3230,Redox: A Rust Operating System
2800,2451,2903,Clojure to JS compiler
2801,2787,613,Format input text content when you are typing...
2802,3779,3646,A tool to enforce Swift style and conventions.
2803,1025,4788,Distributed Task Queue (development branch)
2804,536,5433,CRYENGINE is a powerful real-time game development platform created by Crytek.
2805,2968,2405,Babun - a Windows shell you will love!
2806,485,3269,Node version management
2807,1581,2657,"Modern, Crazy Fast, Ridiculously Easy and Amazingly Powerful Flat-File CMS"
2808,388,2092,Angular Bootstrap Admin Panel Framework
2809,3855,4301,An extensible media player for Android
2810,4117,1325,[ACQUIRED] The fastest web framework for Go in (THIS) Earth. HTTP/2 Ready-To-GO.
2811,4830,3215,The hacker's browser.
2812,3186,2840,"Multiple file upload plugin with image previews, drag and drop, progress bars. S3 and Azure support, image scaling, f"
2813,338,5458,http://torch.ch
2814,2543,5394,Mobile_Detect is a lightweight PHP class for detecting mobile devices (including tablets). It uses the User-Agent str
2815,3312,1738,A curated list of delightful iOS resources.
2816,5047,442,"A fast, convenient and nonintrusive conversion between JSON and model. Your model class don't need to extend another"
2817,4766,2888,A tool for managing secrets.
2818,1231,1651,Static site generator that supports Markdown and reST syntax. Powered by Python.
2819,2063,5606,Reactide is the first dedicated IDE for React web application development. http://reactide.io
2820,1401,3762,Tweak React components in real time.
2821,1995,4314,A reference implementation of GraphQL for JavaScript
2822,1421,3221,"A free & open modern, fast email client with user-friendly encryption and privacy features"
2823,2433,3651,iOS 7/8 style side menu with parallax effect.
2824,1526,5271,A fully featured open source mail delivery platform for incoming & outgoing e-mail
2825,3334,4388,Compass is no longer actively maintained. Compass is a Stylesheet Authoring Environment that makes your website desig
2826,354,5702,"(Looking for Project Maintainers) The mobile-friendly, responsive, and lightweight jQuery date & time input picker."
2827,5076,3598,JSON in JavaScript
2828,3806,1652,Reduce misspelled email addresses in your web apps.
2829,1572,532,Buttons with built-in loading indicators.
2830,3027,1179,StuQ
2831,16,5250,Date range picker component for Bootstrap
2832,299,1462,"A static analyzer for Java, C, C++, and Objective-C"
2833,3892,1470,A D3-based reusable chart library
2834,4925,193,open-source electronics prototyping platform
2835,4361,1284,z - jump around
2836,4536,2681,"A fast, light-weight proxy for memcached and redis"
2837,5128,3718,Odoo. Open Source Apps To Grow Your Business.
2838,3606,948,"Deep Learning for Java, Scala & Clojure on Hadoop & Spark With GPUs - From Skymind"
2839,275,4664,node.js REST framework specifically meant for web service APIs
2840,3831,382,A browser automation framework and ecosystem.
2841,241,2547,A conforming Objective-C WebSocket client library.
2842,1577,3307,tmux source code
2843,4435,3485,"React + Redux starter kit / boilerplate with Babel, hot reloading, testing, linting and a working example app, all bu"
2844,4659,3838,"Make Your Company Data Driven. Connect to any data source, easily visualize and share your data."
2845,2043,3715,Simple javascript toast notifications
2846,4013,5695,Full-sized drag & drop event calendar (jQuery plugin)
2847,3708,3400,Package your Node.js project into an executable
2848,5543,3548,JavaScript parser / mangler / compressor / beautifier toolkit
2849,1343,5537,Highly customizable checkboxes and radio buttons (jQuery & Zepto)
2850,1000,2524,An easy-to-use UITableViewCell subclass that implements a swippable content view which exposes utility buttons (simil
2851,3614,4891,A high quality UI Toolkit built on Vue.js
2852,1650,1089,A Module Loader for the Web
2853,1329,4556,A reactive programming library for JavaScript
2854,395,1343,"Tools of The Trade, from Hacker News."
2855,3829,1351,Dive into Machine Learning with Python Jupyter notebook and scikit-learn
2856,719,4540,Remove unused styles from CSS
2857,5609,791,Demos the new Android Design library.
2858,3211,3155,Lightweight Linux for Docker
2859,883,1962,Cross-platform asynchronous I/O
2860,3292,1026,A REST and realtime API layer for modern applications.
2861,554,5662,Go development plugin for Vim
2862,4004,2278,"A Big Picture, Thesaurus, and Taxonomy of Modern JavaScript Web Development"
2863,4127,2354,"An open IDE for web and native mobile development, built on top of Atom"
2864,3074,2472,"ShadowsocksR update rss, SSR organization https://github.com/shadowsocksr"
2865,2626,2082,Manage complex tmux sessions easily
2866,4386,3262,"Simple, pretty and powerful logger for android"
2867,2400,1263,Super Resolution for images using deep learning.
2868,3255,2224,All things Vim!
2869,1895,3984,the easiest way to use Google Maps
2870,2391,5530,OS X command line tools for developers The ultimate tool to manage your Mac. It provides a huge set of command li
2871,5291,1660,E2E test framework for Angular apps
2872,3489,551,Navigation scripting and testing utility for PhantomJS and SlimerJS
2873,2157,3553,"Some HTML, CSS and JS best practices."
2874,1937,2838,Let's learn a new technology every week. A new technology blog every Sunday in 2016.
2875,5137,3153,A Higher Order Component using react-redux to keep form state in a Redux store
2876,5310,1977,"Forms made easy for Rails! It's tied to a simple DSL, with no opinion on markup."
2877,592,3783,Manage and switch between multiple proxies quickly & easily.
2878,4862,3099,A single-header ANSI C gui library
2879,4610,882,Packer is a tool for creating identical machine images for multiple platforms from a single source configuration.
2880,3566,5478,A library optimized for concise and principled data graphics and layouts.
2881,1632,1823,A collection of services with great free tiers for developers on a budget
2882,4695,4315,"The JavaScript Database, for Node.js, nw.js, electron and the browser"
2883,4928,2674,This repo is being deprecated. Please check out http://github.com/famous/engine
2884,522,2231,
2885,3932,1137,A showcase of the best typefaces from the Google web fonts directory.
2886,2349,708,Dapper - a simple object mapper for .Net
2887,2899,3265,A touch slideout navigation menu for your mobile web apps.
2888,2148,5030,"Hosting git repositories -- Gitolite allows you to setup git hosting on a central server, with very fine-grained acce"
2889,470,3421,A functional and reactive JavaScript framework for predictable code
2890,475,2239,The OpenAPI Specification Repository
2891,109,4931,"A curated list of amazingly awesome Elixir and Erlang libraries, resources and shiny things. Updates:"
2892,4464,2051,The Git interface you've been missing all your life has finally arrived.
2893,1667,3849,"A component-based, event-driven JavaScript framework from Twitter"
2894,1391,969,Automated testing and continous integration framework based on node.js and selenium webdriver
2895,3966,3790,"H2O - the optimized HTTP/1, HTTP/2 server"
2896,4147,1366,Natural language processing in javascript
2897,3208,644,Open source rich text editor based on HTML5 and the progressive-enhancement approach. Uses a sophisticated security c
2898,1798,5688,Twitter Emoji for Everyone
2899,2562,4595,Reactive Programming for Android
2900,2782,2753,"a fast, scalable, multi-language and extensible build system"
2901,3900,4060,A guide for programming in style.
2902,5195,3520,Botkit is a toolkit for making bot applications
2903,3661,4068,"A Scope & Engine based, clean, powerful, customizable and sophisticated paginator for Ruby webapps"
2904,2621,2909,"The ""Python Machine Learning"" book code repository and info resource"
2905,2217,3488,The Swift (and Objective-C) testing framework.
2906,5439,2071,RailsAdmin is a Rails engine that provides an easy-to-use interface for managing your data
2907,4592,5138,general natural language facilities for node
2908,4792,1081,Incredibly simple real-time web for .NET
2909,372,5050,Pretty time-series line graphs
2910,5017,3660,Angular admin dashboard framework
2911,3172,338,"High performance and SEO friendly lazy loader for images (responsive and normal), iframes and more, that detects any"
2912,4901,2639,jQuery plugin for lazy loading images
2913,4571,3650,a short introduction to node.js
2914,4852,3336,An open source status page system for everyone.
2915,5539,2285,This project demonstrates how to access and test the Alexa Voice Service using a Java client (running on a Raspberry
2916,1643,5555,"Theano is a Python library that allows you to define, optimize, and evaluate mathematical expressions involving multi"
2917,3884,3904,A window management application (replacement for Divvy/SizeUp/ShiftIt)
2918,151,4932,OBS - Free and open source software for live streaming and screen recording
2919,3503,4780,"JavaScript is all like ""You images done yet or what?"""
2920,5179,4523,A set of React components implementing Google's Material Design specification with the power of CSS Modules
2921,4404,2769,Microsoft REST API Guidelines
2922,3202,4626,Search Interactive Mind Maps to learn anything
2923,4328,4209,"Horizon is a realtime, open-source backend for JavaScript apps."
2924,4458,1671,Pleasant Android application development
2925,4034,5705,"The ultimate API for iOS & OS X Auto Layout impressively simple, immensely powerful. Objective-C and Swift compatible."
2926,2096,5583,A custom view component that mimics the new Material Design Bottom Navigation pattern.
2927,1645,1592,"Standards for flexible, durable, and sustainable HTML and CSS."
2928,2431,2235,Python Fire is a library for automatically generating command line interfaces (CLIs) from absolutely any Python object.
2929,5312,5326,Mobile Shell
2930,2938,337,after effects to html library
2931,1888,5112,A shell script to set up a macOS laptop for web and mobile development.
2932,679,3702,An embedded key/value database for Go.
2933,1286,1582,"An easy-to-read, quick reference for JS best practices, accepted coding standards, and links around the Web"
2934,270,2659,The open source JavaScript graphing library that powers plotly
2935,5465,1906,Companies that don't have a broken hiring process
2936,2993,4394,Custom fonts in Android the easy way...
2937,4622,3344,HTTPie + prompt_toolkit = an interactive command-line HTTP client featuring autocomplete and syntax highlighting
2938,723,5470,"TCP port scanner, spews SYN packets asynchronously, scanning entire Internet in under 5 minutes."
2939,1786,5517,Mobile UI elements for Vue.js
2940,2315,2742,The modern video player for macOS.
2941,4236,3420,The https://freeCodeCamp.com open source codebase and curriculum. Learn to code and help nonprofits.
2942,2130,460,"The most popular HTML, CSS, and JavaScript framework for developing responsive, mobile first projects on the web."
2943,1131,2019,Freely available programming books
2944,3882,4061,"A declarative, efficient, and flexible JavaScript library for building user interfaces."
2945,2668,5301,"Bring data to life with SVG, Canvas and HTML."
2946,4201,3850,A book series on JavaScript. @YDKJS on twitter.
2947,2377,5699,Computation using data flow graphs for scalable machine learning
2948,495,4856,Curated list of awesome lists
2949,5470,3855,"A progressive, incrementally-adoptable JavaScript framework for building UI on the web."
2950,5613,1398,AngularJS - HTML enhanced for web apps!
2951,191,4560,"A delightful community-driven (with 1,000+ contributors) framework for managing your zsh configuration. Includes 200+"
2952,2990,1543,JavaScript Style Guide
2953,2274,4591,A collection of useful .gitignore templates
2954,1461,4628,The iconic font and CSS toolkit
2955,5436,1969,A framework for building native apps with React.
2956,3768,2502,"Build cross platform desktop apps with JavaScript, HTML, and CSS"
2957,5420,5080,Linux kernel source tree
2958,4172,3100,jQuery JavaScript Library
2959,1042,4652,A complete computer science study plan to become a software engineer.
2960,4569,2444,Moby Project - a collaborative project for the container ecosystem to assemble container-based systems
2961,958,1849,A cross-browser library of CSS animations. As easy to use as an easy thing.
2962,3464,2220,The Swift Programming Language
2963,4229,2335,The hackable text editor
2964,817,1523,"Meteor, the JavaScript App Platform"
2965,4799,4992,"A professional front-end template for building fast, robust, and adaptable web apps or sites."
2966,4711,1487,Node.js JavaScript runtime
2967,453,4003,Moved to https://github.com/nodejs/node
2968,5062,2805,Ruby on Rails
2969,2698,2762,Semantic is a UI component framework based around useful principles from natural language.
2970,3928,584,"A curated list of awesome Python frameworks, libraries, software and resources"
2971,3072,2331,The HTML Presentation Framework
2972,4214,5179,Realtime application framework (Node.JS server)
2973,294,1342,JavaScript 3D library.
2974,1769,119,A PHP Framework For Web Artisans
2975,2212,3509,"Fast, unopinionated, minimalist web framework for node."
2976,148,1164,Predictable state container for JavaScript apps
2977,1988,3595,"Parse, validate, manipulate, and display dates in javascript."
2978,5086,2190,It's a presentation framework based on the power of CSS3 transforms and transitions in modern browsers and inspired b
2979,1020,2945,Call all Node.js modules directly from DOM/WebWorker and enable a new way of writing applications with all Web techno
2980,1011,4554,"Master the command line, in one page"
2981,528,5484,Simple HTML5 Charts using the <canvas> tag
2982,2515,289,Material Design icons by Google
2983,1511,609,"Modern command line HTTP client user-friendly curl alternative with intuitive UI, JSON support, syntax highlighting"
2984,862,2513,Build amazing native and progressive web apps with open web technologies. One app running on everything
2985,4327,5044,"Jekyll is a blog-aware, static site generator in Ruby"
2986,5311,5536,Visual Studio Code
2987,899,4458,A bundler for javascript and friends. Packs many modules into a few bundled assets. Code Splitting allows to load par
2988,5301,450,Resumes generated using the GitHub informations
2989,863,2809,"A delightful networking framework for iOS, OS X, watchOS, and tvOS."
2990,854,1231,The Go programming language
2991,3894,3492,Create React apps with no build configuration.
2992,2364,488,The former home of Homebrew
2993,1289,1432,Magnificent app which corrects your previous console command.
2994,446,828,"A list of helpful front-end related questions you can use to interview potential candidates, test yourself or complet"
2995,2854,3259,"A microframework based on Werkzeug, Jinja2 and good intentions"
2996,4375,2436,Based on a true story
2997,2697,4720,Material Design Components in HTML/CSS/JS
2998,426,2423,"An open source code editor for the web, written in JavaScript, HTML and CSS."
2999,3081,3131,"Materialize, a CSS Framework based on Material Design"
3000,1416,3065,"File Upload widget with multiple file selection, drag&drop support, progress bar, validation and preview images, audi"
3001,5090,2350,Command-line program to download videos from YouTube.com and other video sites
3002,4245,5291,A collection of HTML element and attribute style-normalizations
3003,2703,5451,The streaming build system
3004,1322,340,React Components that Implement Google's Material Design.
3005,3071,1545,"Give your JS App some Backbone with Models, Views, Collections, and Events"
3006,4057,125,The Web framework for perfectionists with deadlines.
3007,4975,4087,"Fast, reliable, and secure dependency management."
3008,4674,774,Python HTTP Requests for Humans
3009,4205,1058,The most advanced responsive front-end framework in the world. Quickly create prototypes and production code for site
3010,212,4207,One framework. Mobile & desktop.
3011,3113,2216,RxJava Reactive Extensions for the JVM a library for composing asynchronous and event-based programs using observ
3012,2560,1182,Original Apollo 11 Guidance Computer (AGC) source code for the command and lunar modules.
3013,1983,3579,Production-Grade Container Scheduling and Management
3014,2499,5666,"A modern JavaScript utility library delivering modularity, performance, & extras."
3015,1785,602,Elegant HTTP Networking in Swift
3016,1278,5240,"Redis is an in-memory database that persists on disk. The data model is key-value, but many different kind of values"
3017,2593,3922,A curated list of awesome Android UI/UX libraries
3018,1655,4662,Ansible is a radically simple IT automation platform that makes your applications and systems easier to deploy. Avoid
3019,2731,3856,Lantern Latest Download https://github.com/getlantern/lantern/releases/tag/latest https://github.com/getl
3020,1525,5308,"A curated list of awesome Machine Learning frameworks, libraries and software."
3021,4918,5452,Roadmap to becoming a web developer in 2017
3022,2913,5072,Papers from the computer science community to read and discuss.
3023,664,3577,"Open Source, Distributed, RESTful Search Engine"
3024,370,4105,A categorized collection of Android Open Source Projects : codekk
3025,3124,2460,Vim-fork focused on extensibility and usability.
3026,4706,365,TypeScript is a superset of JavaScript that compiles to clean JavaScript output.
3027,5547,727,An extensible desktop mail app built on the modern web. Forks welcome!
3028,1352,1635,Declarative routing for React
3029,2030,883,"A simple, powerful publishing platform"
3030,3987,2314,Angular Style Guide: A starting point for Angular development teams to provide consistency through good practices.
3031,3405,3079,Get a full fake REST API with zero coding in less than 30 seconds (seriously)
3032,671,652,Scriptable Headless WebKit
3033,1846,1684,Path to a free self-taught education in Computer Science!
3034,2503,1228,A list of cool features of Git and GitHub.
3035,3737,373,"A safe, concurrent, practical language."
3036,5028,2562,"Type-safe HTTP client for Android and Java by Square, Inc."
3037,3047,5421,"A platform for community discussion. Free, open, simple."
3038,4411,3190,Get control of your servers. Simple. Effective. Awesome! https://my-netdata.io/
3039,3443,3854,Manually curated collection of resources for frontend web developers.
3040,4269,2009,Promise based HTTP client for the browser and node.js
3041,2376,1112,"A curated list of awesome Go frameworks, libraries and software"
3042,5371,3417,Async utilities for node and the browser
3043,2442,861,Babel is a compiler for writing next generation JavaScript.
3044,2925,4691,"Helping you select an MV* framework - Todo apps for Backbone.js, Ember.js, AngularJS, and many more"
3045,4690,856,The Big List of Naughty Strings is a list of strings which have a high probability of causing issues when used as use
3046,3253,1726,"Scrapy, a fast high-level web crawling & scraping framework for Python."
3047,5281,1187,JavaScript's utility _ belt
3048,2361,2253,"Chosen is a library for making long, unwieldy select boxes more friendly."
3049,4140,3772,Overview of ECMAScript 6 features
3050,5464,5117,Modernizr is a JavaScript library that detects HTML5 and CSS3 features in the users browser.
3051,489,3613,An HTTP+HTTP/2 client for Android and Java applications.
3052,3716,2766,"Select2 is a jQuery based replacement for select boxes. It supports searching, remote data sets, and infinite scrolli"
3053,5471,3961,"A curated list of awesome iOS ecosystem, including Objective-C and Swift Projects"
3054,4314,913,"Google Chrome, Firefox, and Thunderbird extension that lets you write email in Markdown and render it before sending."
3055,570,2605,A boilerplate for Node.js web applications
3056,5392,2192,A collection of awesome things regarding React ecosystem.
3057,2025,2471,Node Version Manager - Simple bash script to manage multiple active node.js versions
3058,4366,3486,Design patterns implemented in Java
3059,3735,2634,List of awesome university courses for learning Computer Science!
3060,3249,4545,Gogs is a painless self-hosted Git service.
3061,4291,5033,Production process manager for Node.js apps with a built-in load balancer.
3062,1381,4613,fullPage plugin by Alvaro Trigo. Create full screen pages fast and simple
3063,4223,2691,GitLab CE | Please open new issues in our issue tracker on GitLab.com
3064,1473,231,A list of practical projects that anyone can solve in any programming language.
3065,1624,1371,scikit-learn: machine learning in Python
3066,5107,2166,A collection of samples to discuss and showcase different architectural tools and patterns for Android apps.
3067,4525,288,Immutable persistent data collections for Javascript which increase efficiency and simplicity.
3068,3141,5675,The open-source database for the realtime web.
3069,3145,945,"An awesome list of high-quality open datasets in public domains (on-going). By everyone, for everyone!"
3070,1134,3964,A list of everything that could go in the <head> of your document
3071,2865,2589,A curated list of awesome awesomeness
3072,66,5474,"Certbot, previously the Let's Encrypt Client, is EFF's tool to obtain certs from Let's Encrypt, and (optionally) auto"
3073,4705,5099,A collective list of public JSON APIs for use in web development.
3074,1150,3236,JavaScript library for mobile-friendly interactive maps
3075,4167,2984,"A powerful, interactive charting and visualization library for browser"
3076,5134,2402,Caffe: a fast open framework for deep learning.
3077,4860,4806,the last carousel you'll ever need
3078,3965,2145,
3079,5378,2163,Extensive Open-Source Guides for Android Developers
3080,4732,2041,PDF Reader in JavaScript
3081,872,601,Material design theme for Bootstrap 3 and 4
3082,3979,383,"Updated Jun 24, 2017"
3083,5141,3807,Protocol Buffers - Google's data interchange format
3084,2791,4882,Git Source Code Mirror - This is a publish-only repository and all pull requests are ignored. Please follow Documenta
3085,499,1911,A Fast and Flexible Static Site Generator built with love in GoLang.
3086,5292,126,Ember.js - A JavaScript framework for creating ambitious web applications
3087,4051,3393,Asynchronous image downloader with cache support as a UIImageView category
3088,4455,1047,Build modern apps using web components
3089,1694,5299,Modern copy to clipboard. No Flash. Just 3kb gzipped
3090,5027,3007,"An extensible iOS and OS X animation library, useful for physics-based interactions."
3091,1270,4527,Delightful Node.js packages and resources
3092,37,5058,Models built with TensorFlow
3093,2982,757,Git extensions to provide high-level repository operations for Vincent Driessen's branching model.
3094,1245,4728,Learn how to design large-scale systems. Prep for the system design interview. Includes Anki flashcards.
3095,1898,2633,A terminal built on web technologies
3096,3828,353,A curated list of awesome things related to Vue.js
3097,1229,1377,Streams of values over time
3098,4286,4166,"Serverless Framework Build web, mobile and IoT applications with serverless architectures using AWS Lambda, Azure F"
3099,5241,1944,Realtime MVC Framework for Node.js
3100,2853,2105,Flexible authentication solution for Rails with Warden.
3101,3095,2531,Design Patterns for Humans - An ultra-simplified explanation
3102,2099,2397,Stand-alone parallax scrolling library for mobile (Android + iOS) and desktop. No jQuery. Just plain JavaScript (and
3103,3345,1724,Amazon Web Services a practical guide
3104,352,3605,Google Core Libraries for Java
3105,2950,2692,Use your OS X terminal shell to do awesome things.
