taskID,jobID,employeeRecorID,taskDescription
1390,3018,2267,"Cocos2d-x is a suite of open-source, cross-platform, game-development tools used by millions of developers all over t"
1391,4483,1051,Gin is a HTTP web framework written in Go (Golang). It features a Martini-like API with much better performance -- up
1392,3743,4504,"An extremely fast, React-like JavaScript library for building modern user interfaces"
1393,2224,4358,"Implementation of ImageView for Android that supports zooming, by various touch gestures."
1394,2029,3043,"Yii 2: The Fast, Secure and Professional PHP Framework"
1395,830,3888,Super Awesome Easy Fetching for Core Data 1!!!11!!!!1!
1396,4619,5189,Netty project - an event-driven asynchronous network application framework
1397,2263,2268,how to write node programs with streams
1398,1240,3913,Frontend Knowledge Structure
1399,5500,1413,"Elixir is a dynamic, functional language designed for building scalable and maintainable applications"
1400,2667,3028,Docker Cheat Sheet
1401,1654,5497,jQuery Mobile Framework
1402,3519,5550,A server-side Swift web framework.
1403,700,5090,"Hystrix is a latency and fault tolerance library designed to isolate points of access to remote systems, services and"
1404,3812,4697,A Swift Autolayout DSL for iOS & OS X
1405,92,772,"Drone is a Continuous Delivery platform built on Docker, written in Go"
1406,5274,3722,The official jQuery user interface library.
1407,2443,2938,Full featured HTML framework for building iOS & Android apps
1408,5023,4377,Sass makes CSS fun again.
1409,1164,5064,Blazing fast React.js static site generator
1410,3430,5707,The JavaScript library for modern SVG graphics.
1411,3992,4297,"A showcase of problems once hard or impossible to solve with CSS alone, now made trivially easy with Flexbox."
1412,1823,2087,This repo is for demonstration purposes only.
1413,3945,4024,Package manager for Xcode
1414,4103,2407,"Flexible and powerful data analysis / manipulation library for Python, providing labeled data structures similar to R"
1415,3412,5338,JavaScript Regular expressions made easy
1416,5092,4936,"Source code of the official F8 app of 2016, powered by React Native and other Facebook open source projects."
1417,1841,1127,Perceptual JPEG encoder
1418,1316,3161,JSPatch bridge Objective-C and Javascript using the Objective-C runtime. You can call any Objective-C class and metho
1419,4634,1298,The open-source Trello-like kanban (built with Meteor)
1420,4391,2203,"A starter boilerplate for a universal webapp using express, react, redux, webpack, and react-transform"
1421,1692,639,Define and run multi-container applications with Docker
1422,5063,1833,"Streisand sets up a new server running L2TP/IPsec, OpenConnect, OpenSSH, OpenVPN, Shadowsocks, sslh, Stunnel, a Tor b"
1423,2187,3914,An Asynchronous HTTP Library for Android
1424,5162,308,Style guides for Google-originated open-source projects
1425,1036,3597,Automated installation of the Microsoft IE App Compat virtual machines
1426,1503,1005,Selectize is the hybrid of a textbox and <select> box. It's jQuery based and it has autocomplete and native-feeling k
1427,1811,2874,"Amaze UI, a mobile-first and modular front-end framework."
1428,443,3700,A clean and lightweight progress HUD for your iOS and tvOS app.
1429,1148,897,A lightweight and modular front-end framework for developing fast and powerful web interfaces
1430,1277,2284,A collection of useful .htaccess snippets.
1431,2479,2892,"History.js gracefully supports the HTML5 History/State APIs (pushState, replaceState, onPopState) in all browsers. In"
1432,2145,5615,A datepicker for twitter bootstrap (@twbs)
1433,1159,3087,A simple CLI tool for ensuring that a given script runs continuously (i.e. forever)
1434,1929,2749,Productive. Reliable. Fast.
1435,5255,5136,JavaScript Testing utilities for React
1436,4969,4716,Everything you need to know to get the job.
1437,4239,4399,Library for fast text representation and classification.
1438,412,2453,Content aware image cropping
1439,351,3640,A creative-commons book on Backbone.js for beginners and advanced users alike
1440,267,4787,Cross-browser storage for all use cases Used across the web See below for v2.0 news!
1441,298,2523,In-browser markdown editor
1442,3055,2134,Build terminal dashboards using ascii/ansi art and javascript
1443,1840,2142,Reactive Programming in Swift
1444,4728,4331,Next-generation ES6 module bundler
1445,685,367,LevelDB is a fast key-value storage library written at Google that provides an ordered mapping from string keys to st
1446,1886,1525,The aurelia framework brings together all the required core aurelia libraries into a ready-to-go application-building
1447,4276,492,"A curated list of awesome command-line frameworks, toolkits, guides and gizmos. Inspired by awesome-php."
1448,5387,1125,"Simple, scalable state management."
1449,2689,4157,"ES2015 [ES6] cheatsheet containing tips, tricks, best practices and code snippets"
1450,2894,3729,The Light Table IDE
1451,2802,3626,"A simple, decentralized dependency manager for Cocoa"
1452,154,3558,"Prepack is a partial evaluator for JavaScript. Prepack rewrites a JavaScript bundle, resulting in JavaScript code tha"
1453,1534,1585,Remote multi-server automation tool
1454,1569,2469,Smooth scrolling for the web
1455,660,2743,List of Computer Science courses with video lectures.
1456,3569,568,A realtime distributed messaging platform
1457,5529,3367,Simple responsive charts
1458,5593,3877,A collection of tips to help take your CSS skills pro
1459,1986,2862,The Servo Browser Engine
1460,5298,4855,Octopress is an obsessively designed framework for Jekyll blogging. Its easy to configure and easy to deploy. Sweet
1461,3506,2655,A GNU Social-compatible microblogging server
1462,2127,1286,Simplified and community-driven man pages
1463,4251,4481,A pure node.js JavaScript Client implementing the MySql protocol.
1464,360,2551,"Updated Apr 18, 2017"
1465,3488,1717,Groom your apps Ruby environment
1466,1762,2613,Dependency Manager for PHP
1467,2724,1423,CodeHub is an iOS application written using Xamarin
1468,4730,2793,"A simple HTML5, YouTube and Vimeo player"
1469,1824,2302,Responsive dashboard templates for Bootstrap
1470,2918,5083,"Curated tutorial and resource links I've collected on React, Redux, ES6, and more"
1471,5573,453,A curated list of awesome iOS UI/UX libraries
1472,2991,4965,Service Discovery and Configuration Made Easy
1473,2333,4212,The Cocoa Dependency Manager.
1474,315,332,The ultimate Vim configuration: vimrc
1475,5501,5696,A fast JSON parser/generator for Java
1476,3577,827,Play Framework
1477,556,1248,"A simple, highly customisable, data-driven 3D carousel for iOS and Mac OS"
1478,2468,1521,Android Transition animations explanation with examples.
1479,418,3493,Light and responsive lightbox script with focus on performance.
1480,4731,4027,Classy web framework for Go
1481,3106,1040,Fast Android Development. Easy maintainance.
1482,1368,962,Flat Color Framework for iOS (Obj-C & Swift)
1483,1530,4170,"Offline storage, improved. Wraps IndexedDB, WebSQL, or localStorage using a simple but powerful API."
1484,1192,4407,"Recently updated with 50 new notebooks! Data science Python notebooks: Deep learning (TensorFlow, Theano, Caffe, Kera"
1485,3690,3403,The official Vim repository
1486,3448,3852,Material Design components for Angular
1487,1773,5165,Classy web-development dressed in a DSL (official / canonical repo)
1488,1058,5297,HTML5 FLV Player
1489,2485,3847,lean & mean status/tabline for vim that's light as air
1490,3329,5178,Node.js by alsotang
1491,5211,5601,"Material Theme, the most epic theme for Sublime Text 3 by Mattia Astorino"
1492,5532,2315,Algorithm Visualizer
1493,410,1835,"Guzzle, an extensible PHP HTTP client"
1494,5209,4269,"WordPress, Git-ified. Synced via SVN every 15 minutes, including branches and tags! This repository is just a mirror"
1495,4029,1659,A command-line fuzzy finder written in Go
1496,837,1527,
1497,2680,3146,Elegant transition library for iOS & tvOS
1498,2568,4920,"SQL powered operating system instrumentation, monitoring, and analytics."
1499,3954,3703,Code tree for GitHub
1500,2573,4714,"Auditing, performance metrics, and best practices for Progressive Web Apps"
1501,2373,4633,Codeless drop-in universal library allows to prevent issues of keyboard sliding up and cover UITextField/UITextView.
1502,5594,5443,"A collection of awesome browser-side JavaScript libraries, resources and shiny things."
1503,1589,3268,A spring that solves your animation problems.
1504,1177,713,A CLI dashboard for webpack dev server
1505,2902,419,Give your pages some headroom. Hide your header until you need it
1506,5058,4712,LoopBack makes it easy to build modern applications that require complex integrations.
1507,29,1386,REST API for any Postgres database
1508,2014,1435,A typeface designed for source code
1509,3455,1518,pathogen.vim: manage your runtimepath
1510,1759,3349,Standards either proposed or approved by the Framework Interop Group
1511,3534,1165,"A fast & simple, yet powerful & flexible logging framework for Mac and iOS"
1512,1066,4283,"A responsive image polyfill for <picture>, srcset, sizes, and more"
1513,2269,1104,"Tinker is a hot-fix solution library for Android, it supports dex, library and resources update without reinstall apk."
1514,1509,2829,A curated list of awesome remote jobs and resources. Inspired by https://github.com/vinta/awesome-python
1515,4459,2045,"Get started with React, Redux, and React-Router."
1516,1111,2804,A Java serialization/deserialization library to convert Java Objects into JSON and back
1517,2237,2147,JavaScript Vector Library
1518,3352,5113,"Dubbo is a distributed, high performance RPC framework empowering applications with service import/export capabili"
1519,5118,3940,React Native for macOS is an experimental fork for writing desktop apps using Cocoa
1520,4617,376,An Android app which provides design news & inspiration as well as being an example of implementing material design.
1521,5364,2856,Command-line JSON processor
1522,3140,3811,Jargon from the functional programming world in simple terms!
1523,5171,4603,"Code and data for paper ""Deep Photo Style Transfer"": https://arxiv.org/abs/1703.07511"
1524,1276,5650,uBlock Origin - An efficient blocker for Chromium and Firefox. Fast and lean.
1525,669,4964,& Apps///
1526,2878,2193,Font files available from Google Fonts
1527,4606,1346,Resume template for Chinese programmers . PHPiOSAndroidWebJavaC
1528,1672,3220,Create an Apple-like one page scroller website (iPhone 5S website) with One Page Scroll plugin
1529,2932,4028,Themes for Bootstrap
1530,2578,4900,Relay is a JavaScript framework for building data-driven React applications.
1531,2348,5681,- PouchDB is a pocket-sized database.
1532,2057,3289,Paging indicator widgets compatible with the ViewPager from the Android Support Library and ActionBarSherlock.
1533,3475,206,A Powerful Spider(Web Crawler) System in Python.
1534,3616,4284,Your guide to the (sometimes overwhelming!) React ecosystem.
1535,5297,1176,An iOS library to natively render After Effects vector animations
1536,798,2882,List of useful Quick Look plugins for developers
1537,1332,4809,Mars is a cross-platform network component developed by WeChat.
1538,5168,3142,"Distributed and fault-tolerant realtime computation: stream processing, continuous computation, distributed RPC, and"
1539,3792,1096,The classic email sending library for PHP
1540,4663,3821,A self-taught project to learn Swift.
1541,1936,5267,Metasploit Framework
1542,2636,4488,"CSS is powerful, you can do a lot of things without JS."
1543,3964,2858,
1544,4692,1241,"Updated Jun 12, 2017"
1545,1679,2886,Universal markup converter
1546,4866,1725,React Nativereact-nativeApp
1547,1551,1445,A public list of APIs from round the web.
1548,4246,4392,This is a sample app that is part of a series of blog posts I have written about how to architect an android applicat
1549,2631,4335,A small clone of 1024 (https://play.google.com/store/apps/details?id=com.veewo.a1024)
1550,697,2468,Keep multiple browsers & devices in sync when building websites. http://browsersync.io
1551,5381,1321,The new JavaScript- and API-powered WordPress.com
1552,5519,3419,Automatic SQL injection and database takeover tool
1553,1142,2890,Apple TV Aerial Screensaver for Mac
1554,3077,1320,An iOS/OSX bridge for sending messages between Obj-C and JavaScript in UIWebViews/WebViews
1555,695,4562,"A collection of various awesome lists for hackers, pentesters and security researchers"
1556,4217,1084,PocketHub Android App
1557,1735,650,"A lightweight, pure-Swift library for downloading and caching images from the web."
1558,42,1175,make your credit card form better in one line of code
1559,3669,5149,The Julia Language: A fresh approach to technical computing.
1560,4834,5210,Asynchronous socket networking library for Mac and iOS
1561,4425,3266,An open-source C++ library developed and used at Facebook.
1562,3544,4214,A spinning activity indicator
1563,3002,2536,A drop-in UITableView/UICollectionView superclass category for showing empty datasets whenever the view has no conten
1564,4539,280,Normalizes nested JSON according to a schema
1565,9,2713,Image Super-Resolution for Anime-Style Art
1566,1836,1923,"Terraform is a tool for building, changing, and combining infrastructure safely and efficiently."
1567,4993,2378,Spectacular Test Runner for JavaScript
1568,1565,4700,"Simple, Pythonic remote execution and deployment."
1569,290,2729,TiDB is a distributed NewSQL database compatible with MySQL protocol
1570,3323,2126,JavaScript library to make drawing animation on SVG
1571,210,472,"A curated list of awesome C/C++ frameworks, libraries, resources, and shiny things. Inspired by awesome-... stuff."
1572,1703,5672,Awesome list of Redux examples and middlewares
1573,3288,1053,Yeoman - a set of tools for automating development workflow
1574,1701,1339,Self-hosted chat app for small teams
1575,3742,699,The javascript library for magical scroll interactions.
1576,1546,1921,Easy file attachment management for ActiveRecord
1577,858,4435,A pure PHP library for reading and writing spreadsheet files
1578,3904,2291,Screenshots with JavaScript
1579,1331,4663,vue2 + vuex 45
1580,1194,2004,"Trfik, a modern reverse proxy"
1581,5224,5355,A simple and beautiful chart lib used in Piner and CoinsMan for iOS
1582,4971,2611,Open software engineering platform and fun adventure game
1583,1574,2324,Catalog of React Components & Libraries
1584,5136,2333,Minimal examples of data structures and algorithms in Python
1585,783,2814,Patched fonts for Powerline users.
1586,2345,2493,An alternative side effect model for Redux apps
1587,3440,1156,Spree is a complete open source ecommerce solution for Ruby on Rails
1588,1045,4669,Android
1589,5571,3460,Practical functional Javascript
1590,2084,4460,Godot Engine Multi-platform 2D and 3D game engine
1591,2818,2408,WordPress starter theme with a modern development workflow
1592,3215,1446,Waypoints is a library that makes it easy to execute a function whenever you scroll to an element.
1593,3560,2498,"A list of popular/awesome videos games, add-ons, maps, etc. hosted on GitHub. Any genre. Any platform. Any engine."
1594,996,2359,The Scala programming language
1595,4104,1173,The Crystal Programming Language
1596,2661,1513,Machine LearningDeep LearningPostgreSQLDistributed SystemNode.JsGolang
1597,265,578,swift implementation of flappy bird. More at fullstackedu.com
1598,889,1913,"A high productivity, full-stack web framework for the Go language."
1599,3872,3111,Live visualization of all the pokemon in your area... and more! (shutdown)
1600,2729,1981,"Xcode plug-in which helps you write documentation comment easier, for both Objective-C and Swift."
1601,4513,1461,The Python programming language
1602,1696,5183,TimelineJS: A Storytelling Timeline built in JavaScript.
1603,2406,4040,Colour schemes for a variety of editors created by Dayle Rees.
1604,1908,4224,"Swagger UI is a collection of HTML, Javascript, and CSS assets that dynamically generate beautiful documentation from"
1605,4195,4328,Flexbox for Android
1606,274,4404,"The ultimate generator based flow-control goodness for nodejs (supports thunks, promises, etc)"
1607,826,3653,Client-side JavaScript PDF generation for everyone.
1608,4908,2294,"fugitive.vim: a Git wrapper so awesome, it should be illegal"
1609,1365,1909,Elegant theme for Hexo.
1610,2764,4846,Oxford Deep NLP 2017 course
1611,2435,4705,This repo is the official home of .NET on GitHub. It's a great starting point to find many .NET OSS projects from Mic
1612,918,1010,Dynamic ES module loader
1613,3432,5613,"A simple, Git-powered wiki with a sweet API and local frontend."
1614,1852,2956,Vue UI Components based on WeUI
1615,546,3687,Filter & sort magical layouts
1616,1203,1444,"An Angular Starter kit featuring Angular 4 (Router, Http, Forms, Services, Tests, E2E, Dev/Prod, HMR, Async/Lazy R"
1617,1552,2745,Possibly the smallest compiler ever
1618,147,2663,Centralized State Management for Vue.js.
1619,2955,638,Good-lookin' diffs. Actually nah The best-lookin' diffs.
1620,5207,5403,"Knockout makes it easier to create rich, responsive UIs with JavaScript"
1621,2104,4759,Free resources for learning Full Stack Web Development
1622,4303,2085,This script is the defacto way to enable use of HTML5 sectioning elements in legacy Internet Explorer.
1623,2320,375,This is a library with components of Android L to you use in android 2.2
1624,4068,4601,"No longer maintained, superseded by JS Cookie:"
1625,823,5522,DEPRECATED
1626,279,3665,Android
1627,3581,2755,"An independent, student-led replication of DeepMind's 2016 Nature publication, ""Mastering the game of Go with deep ne"
1628,2771,2760,Official React bindings for Redux
1629,2663,5009,The future of online communications.
1630,5126,1293,"Expressive, robust, feature-rich CSS language built for nodejs"
1631,5506,4172,A Lightweight Sass Tool Set
1632,4544,1199,Design Patterns implemented in Swift
1633,1440,3799,"Javascript Canvas Library, SVG-to-Canvas (& canvas-to-SVG) Parser"
1634,1911,4533,The Most Powerful Swipe Layout!
1635,3473,2806,"Turn any program that uses STDIN/STDOUT into a WebSocket server. Like inetd, but for WebSockets."
1636,4497,1269,JavaScript Patterns
1637,3372,595,Handsontable Community Edition - a JavaScript/HTML5 Spreadsheet Library for Developers
1638,2168,598,node.js command-line interfaces made easy
1639,1949,4183,Transparent proxy server that works as a poor man's VPN. Forwards over ssh. Doesn't require admin. Works with Linux a
1640,1195,743,Creative Resources for Developer and Designer :)
1641,1170,5424,Syntax checking hacks for vim
1642,3319,5371,Visual primitives for the component age
1643,5000,5259,AngularJS service to handle Rest API Restful Resources properly and easily
1644,405,1910,"High performance, full-stack PHP framework delivered as a C extension."
1645,3149,4944,A tree explorer plugin for vim.
1646,3131,333,Obsessive cheat sheet to favicon sizes/types. Please contribute! (Note: this may be in flux as I learn new things abo
1647,3369,2649,
1648,5582,2996,Javascript audio library for the modern web.
1649,4160,2869,Web APIs for Django.
1650,1871,2104,Slim Framework source code
1651,5283,3119,Slim Framework source code
1652,2545,1552,An opinionated framework for creating REST-like APIs in Ruby.
1653,3117,5219,An animation and graphics framework for Material Design in Swift.
1654,5187,343,Token-based AngularJS Authentication
1655,5098,4550,"The perfect library for adding search, sort, filters and flexibility to tables, lists and various HTML elements. Buil"
1656,4259,1597,Capture website screenshots
1657,875,2073,Ultra Pull to Refresh for Android. Support all the views.
1658,2204,2172,A modern editor with a backend written in Rust.
1659,4452,5643,An in-app debugging and exploration tool for iOS
1660,3073,881,render React components to Sketch
1661,2999,512,String validation
1662,27,1303,Server Framework for Node.js
1663,980,327,Realm is a mobile database: a replacement for SQLite & ORMs
1664,1851,3992,A private messenger for Android.
1665,4597,4355,An interactive TLS-capable intercepting HTTP proxy for penetration testers and software developers
1666,276,5052,"ShellCheck, a static analysis tool for shell scripts"
1667,3866,2377,redis client for node
1668,2595,4424,greenDAO is a light & fast ORM solution for Android that maps objects to SQLite databases.
1669,5070,106,"The Swiss Army Knife of Vector Graphics Scripting Scriptographer ported to JavaScript and the browser, using HTML5"
1670,4960,3784,Memory Efficient Serialization Library
1671,1787,1817,A Virtual DOM and diffing algorithm
1672,1482,2959,"Powerful and flexible RecyclerAdapter, www.recyclerview.org"
1673,4088,1589,This sample shows how to implement an audio media app that works across multiple form factors and provide a consisten
1674,2738,1798,"Validate your forms, frontend, without writing a single line of javascript"
1675,690,2373,"A library that provides an embeddable, persistent key-value store for fast storage."
1676,624,1616,A fully pluggable tool for identifying and reporting on patterns in JavaScript.
1677,4137,2979,"Turn your two-bit doodles into fine artworks with deep neural networks, generate seamless textures from photos, trans"
1678,1641,264,"An easy way to add a simple, shimmering effect to any view in an iOS app."
1679,4087,5249,TensorFlow - A curated list of dedicated resources http://tensorflow.org
1680,3226,3590,Put the output from any script or program in your Mac OS X Menu Bar
1681,4869,5539,"Stetho is a debug bridge for Android applications, enabling the powerful Chrome Developer Tools and much more."
1682,1064,3754,Micro check library
1683,4556,5557,Send e-mails with Node.JS easy as cake!
1684,4421,2034,Acceptance test framework for web applications
1685,643,867,"Resque is a Redis-backed Ruby library for creating background jobs, placing them on multiple queues, and processing t"
1686,4560,2520,"This repo contains the .NET Core runtime, called CoreCLR, and the base library, called mscorlib. It includes the garb"
1687,4080,1960,Share your terminal as a web application
1688,580,4539,A shadowsocks client for Android
1689,4670,1476,A continuously expanded list of framework/libraries and tools I used/want to use when building things on the web. Mos
1690,4641,4383,
1691,2679,1705,Simple library for handling keyboard shortcuts in Javascript
1692,4279,132,A guide to learn bash
1693,1867,451,"DevTools for Redux with hot reloading, action replay, and customizable UI"
1694,4300,1842,Yoga is a cross-platform layout engine which implements Flexbox. Follow https://twitter.com/yogalayout for updates.
1695,1013,5266,A personal music streaming server that works.
1696,4481,3537,"A JavaScript implementation of the WHATWG DOM and HTML standards, for use with node.js"
1697,1695,1712,A fully functional local AWS cloud stack. Develop and test your cloud apps offline!
1698,4576,4095,Promises for Swift & ObjC
1699,629,5034,The user-friendly command line shell.
1700,4006,5585,"Generate polished rsums and CVs in HTML, Markdown, LaTeX, MS Word, PDF, plain text, JSON, XML, YAML, smoke signal,"
1701,445,1993,"Effing package management! Build packages for multiple platforms (deb, rpm, etc) with great ease and sanity."
1702,647,339,Software to automate the management and configuration of any infrastructure or application at scale. Get access to th
1703,2390,2581,Spectacle allows you to organize your windows without using a mouse.
1704,2380,1532,Minimalist Vim Plugin Manager
1705,3844,1014,"uBlock: a fast, lightweight, and lean blocker for Chrome, Firefox, and Safari."
1706,4107,3519,"A Ruby static code analyzer, based on the community Ruby style guide."
1707,1873,603,A drop-in UIViewController subclass with a growing text input view and other useful messaging features
1708,4288,4198,Template auto layout cell for automatically UITableViewCell height calculating
1709,3751,352,jQuery Validation Plugin library sources
1710,3016,3717,The missing package manager for macOS
1711,3342,3199,"JavaScript Robotics and IoT programming framework, developed at Bocoup."
1712,4089,1442,Deep Learning Book Chinese Translation
1713,5234,1374,lightweight and powerful datetimepicker with no dependencies
1714,3886,4312,"A fast,scalable,distributed game server framework for Node.js."
1715,2501,2503,[UNMAINTAINED] Neural networks in JavaScript
1716,5005,4453,a multi-transport async logging library for node.js
1717,2546,3621,A JavaScript library for efficient data fetching
1718,5048,5148,Grumpy is a Python to Go source code transcompiler and runtime.
1719,1325,796,Automatically display online/offline indication to your users
1720,1136,863,A rich text editor for everyday writing
1721,2885,4552,Retro video game emulation for macOS
1722,3296,1860,A beautiful web dashboard for Linux
1723,3303,1369,ZeroNet - Decentralized websites using Bitcoin crypto and BitTorrent network
1724,2366,2055,The configuration framework for Zsh
1725,2404,4589,"Scalable, Portable and Distributed Gradient Boosting (GBDT, GBRT or GBM) Library, for Python, R, Java, Scala, C++ and"
1726,3395,3072,"The .NET Compiler Platform (""Roslyn"") provides open-source C# and Visual Basic compilers with rich code analysis APIs."
1727,2627,1275,Cute view animation collection.
1728,1494,3874,IPFS - The Permanent Web
1729,3641,482,"The flexible, easy to use, all in one drawer library for your Android project."
1730,4231,3916,A Javascript Framework for Building Brilliant Applications (development repo)
1731,4322,2739,"High performance, minimalist Go web framework"
1732,5075,262,Android library to observe scroll events on scrollable views.
1733,757,3759,"Powerline is a statusline plugin for vim, and provides statuslines and prompts for several other applications, includ"
1734,2089,2582,"Logstash - transport and process your logs, events, or other data"
1735,4823,1888,Android application powering the mirror in my house
